품질관리자,신입,1,경험,84,"경험, 업무, 생각, 생산, 노력, 결과, 문제, 공정, 분석, 진행, 관리, 시간, 때문, 개선, 목표, 과정, 중요, 데이터, 제품, 실험"
품질관리자,신입,2,성장과정,28,"동아리, 노력, 경험, 생각, 활동, 생산, 문제, 업무, 학생, 생활, 시간, 목표, 사람, 학교, 공정, 전공, 해결, 모습, 동안, 결과"
품질관리자,신입,3,직무,18,"생산, 관리, 품질, 생각, 성장, 제품, 직무, 기술, 공정, 자동차, 환경, 기업, 경험, 중요, 부서, 업무, 고객, 시험, 문제, 능력"
품질관리자,신입,4,지원동기,12,"품질, 제품, 다양, 생산, 생각, 발전, 성장, 전기, 화학, 산업, 지식, 노력, 관련, 관리, 기본, 지원, 제약, 설비, 업무, 전공"
품질관리자,신입,5,강점,12,"생산, 수행, 문제, 관리, 품질, 실험, 공정, 업무, 생각, 능력, 시간, 직무, 강점, 경험, 발생, 분석, 노력, 계획, 진행, 과정"
품질관리자,인턴,1,경험,17,"경험, 품질, 제품, 업무, 생각, 팀원, 생산, 정비, 관리, 진행, 결과, 현장, 소통, 재고, 이해, 준비, 노력, 시간, 과정, 목표"
품질관리자,인턴,2,지원동기,6,"생산, 생각, 엔지니어, 노벨, 리스, 공정, 관리, 산업, 전공, 안전, 중요, 업무, 현장, 제품, 제어, 지원, 품질, 경험, 플랜트, 국가"
품질관리자,인턴,3,성장과정,5,"팀원, 경험, 연구, 목표, 활동, 다양, 공학, 조직, 자료, 이해, 시작, 대회, 노력, 결과, 산업, 재료, 분야, 진행, 프로젝트, 실험실"
품질관리자,인턴,4,강점,2,"생산, 관리, 지식, 노력, 전공, 공학, 효율, 활용, 능력, 경험, 바탕, 운영, 정보, 취득, 데이터, 공정, 엔지니어, 전기, 설비, 시설"
품질관리자,인턴,5,직무,2,"품질, 식품, 관리, 보쉬, 관련, 생산, 유통, 획득, 중요, 경영, 시그마, 활동, 생각, 자격증, 취득, 점검, 기회, 문제, 시스템, 고객"
해외영업,신입,1,경험,15,"경험, 업무, 고객, 시간, 카페, 직원, 공부, 수행, 업체, 상황, 사람, 편입, 아르바이트, 목표, 때문, 영업, 커피, 다양, 가능, 부족"
해외영업,신입,2,지원동기,8,"경험, 영업, 고객, 생각, 업무, 글로벌, 사람, 시장, 소통, 카페베네, 다양, 방문, 현대, 해외, 수출, 관리, 생산, 세계, 종합, 금속"
해외영업,신입,3,직무,7,"해외, 영업, 고객, 직무, 학생, 시장, 경험, 생각, 문화, 능력, 역량, 연수, 철강, 도전, 소통, 업무, 정확, 정보, 다양, 카투사"
해외영업,신입,4,성장과정,4,"노력, 말씀, 러시아어, 목표, 공부, 생각, 사장, 경험, 때문, 시간, 중요, 수출, 관련, 통역, 과정, 대회, 팀원, 팔로워, 영상, 지금"
해외영업,신입,5,자기소개,3,"적극, 농구, 행사, 시간, 때문, 기여, 상사, 오렌지, 도전, 사람, 산업, 조직, 이후, 정리, 준비, 아르바이트, 시찰, 과제, 추구, 고등학교"
헤드헌터,신입,1,지원동기,1,"채용, 업무, 켈리, 서비스, 인력, 관리, 기업, 관련, 아르바이트, 교육, 관심, 분야, 훈련, 성장, 다수, 자원, 생각, 회사, 달성, 고객"
헤드헌터,신입,2,성장과정,1,"업무, 노력, 프로젝트, 인턴, 퇴근, 책임감, 소속감, 연수, 학생, 복습, 적응, 수첩, 이해, 진행, 당일, 결과, 경험, 단기, 과정, 기업"
헤드헌터,신입,3,장단점,1,"결정, 노력, 고민, 시간, 근성, 자신, 감량, 의지, 생각, 선택, 목표, 하나, 체중, 시절, 지금, 결과, 장점, 달성, 고3, 수능"
현장관리자,신입,1,경험,15,"업무, 프로젝트, 시공, 건설, 관리, 경험, 생각, 능력, 현장, 시간, 소통, 관계, 문제, 도전, 책임감, 신뢰, 관리자, 설계, 진행, 다양"
현장관리자,신입,2,역량,4,"현장, 생각, 안전, 건축, 지식, 실제, 업무, 시공, 진행, 품질, 관리, 책임감, 공사, 역량, 건설, 균열, 설계, 직무, 경험, 기사"
현장관리자,신입,3,지원동기,4,"환경, 생각, 기업, 업무, 소통, 지원, 목표, 때문, 공부, 처리, 토목, 기술, 엔지니어, 이해, 결과, 생산, 노하우, 태영건설, 성장, 발생"
현장관리자,신입,4,성장과정,3,"성장, 시간, 목표, 노력, 팀원, 도전, 업무, 동부건설, 생각, 수행, 다양, 때문, 실험, 경험, 과정, 진행, 준비, 효율, 토양, 활동"
현장관리자,신입,5,직무,3,"안전, 현장, 지속, 품질, 건설, 최고, 관리, 균열, 공사, 확인, 사고, 코오롱글로벌, 콘크리트, 프로젝트, 경험, 전공, 인턴십, 예방, 고리, 이란"
호텔종사자,신입,1,성장과정,1,"감사, 대학, 학비, 적응, 부족, 공부, 현재, 전환점, 입학, 재정, 가족, 부담, 워킹홀리데이, 선택, 이유, 목표, 보조, 경험, 기간, 전체"
호텔종사자,인턴,1,성장과정,1,"성장, 경험, 결정, 사회, 서비스, 개월, 환경, 시간, 지역, 세상, 다양, 사람, 모교, 한마디, 상의, 휴학, 의견, 부모, 응원, 모습"
호텔종사자,인턴,2,장단점,1,"생각, 행동, 상황, 장점, 입장, 고려, 학교, 방문, 근무, 고객, 친절, 지니, 최선, 순간, 사람, 모교, 홍보, 대사, 고등학생, 필요"
호텔종사자,인턴,3,지원동기,1,"진에어, 항공사, 성장, 기내, 중대형, 항공기, 도입, 대한민국, 승무원, 외국인, 안전, 경쟁사, 하나, 단거리, 기종, 과다, 경쟁, 몰입, 동안, 국내"
홍보,신입,1,경험,3,"문화, 출연자, 진행, 촬영, 소통, 경험, 프로그램, 유학, 중요, 업무, 다양, 사람, 인턴, 러브, 모습, 의사소통, 조직, 상대, 중국, 한국"
홍보,신입,2,성장과정,1,"변화, 영향력, 방송, 광고, 자존감, 바닥, 각자, 위치, 불평, 최선, 사람, 마음가짐, 사회, 긍정, 다짐, 이후, 목표, 실현, 대중, 매체"
홍보,신입,3,팀워크,1,"사람, 감독, 문제, 업무, 배려, 상황, 갈등, 진행, 양보, 손해, 직업, 협업, 출연자, 작가, 카메라맨, 오디오, 편집, 하나, 시간, 방송"
홍보,인턴,1,경험,2,"동아리, 사람, 홍보, 마케팅, 페어, 활동, 프로젝트, 가치, 부서, 협업, 진행, 다양, 시간, 마지막, 인력, 분배, 부스, 인원, 분야, 관심"
화학엔지니어,신입,1,경험,26,"연구, 공정, 경험, 생각, 목표, 진행, 설계, 개발, 학생, 화학, 관리, 노력, 향상, 제작, 환경, 방법, 결과, 바탕, 문제, 센서"
화학엔지니어,신입,2,성장과정,6,"분리, 모듈, 생각, 연구, 배려, 해결, 때문, 경험, 성능, 향상, 과정, 사람, 혼자, 계획, 문제, 학생, 금주, 주도, 이산화탄소, 제작"
화학엔지니어,신입,3,직무,2,"재료, 생각, 환경, 전자, 개발, 소재, 연구, 경영, 연구자, 부분, 과정, 반도체, 도입, 활용, 지속, 가능, 사회, 실현, 분야, 필수"
화학엔지니어,신입,4,가치관,2,"소재, 가치, 기술, 유기, 인턴, 공학, 개발, 전지, 이익, 행복, 기관, 설계, 프로젝트, 진행, 교내, 지식, 관련, 공정, 수강, 화학"
화학엔지니어,신입,5,장단점,2,"열정, 때문, 생각, 책임감, 호기심, 단점, 걱정, 기록, 긍정, 실천, 사람, 관계, 보완, 이용, 장점, 성실, 동반, 주위, 피해, 대학"
화학엔지니어,인턴,1,경험,10,"활동, 생각, 봉사, 행사, 업무, 다양, 소통, 모임, 참여, 기업, 수행, 지원, 시간, 관리, 제품, 경험, 학년, 처리, 해결, 과정"
화학엔지니어,인턴,2,자기소개,2,"경험, 생각, 진행, 지원, 수행, 사업, 도전, 한국, 기초, 과학, 학교, 실험, 특허, 미생물, 에너지, 공정, 노력, 연구원, 다양, 동아리"
화학엔지니어,인턴,3,역량,1,"수돗물, 수질, 사람, 처리, 인식, 공급, 우리, 나라, 세계, 대부분, 이유, 정수, 과정, 불신, 수도관, 노후, 파손, 오염, 생수, 차이"
화학엔지니어,인턴,4,직무,1,"진행, 경험, 실패, 실험, 제품, 개발, 다양, 연구, 기초, 브랜드, 지식, 결과, 사용, 직무, 성장, 시작, 과정, 동안, 합성, 토대"
화학엔지니어,인턴,5,성공,1,"결과, 실질, 노력, 연구, 위기, 진행, 필름, 성공, 기업, 생각, 석사, 과정, 상대, 습도, 형성, 조절, 문제점, 해결, 동안, 최선"
환경기사,신입,1,경험,7,"제작, 예산, 기사, 행사, 자료, 팀원, 진행, 문제, 친구, 프로그램, 복지, 에너지, 화학, 생각, 안정, 공공, 목표, 직무, 시간, 결과"
환경기사,신입,2,직무,1,"실험, 계획, 분석, 능력, 개선, 반응, 효율, 중간, 기록, 화학, 공정, 안정, 수립, 토대, 진행, 발전, 철저, 안전, 관리, 결과"
환경기사,신입,3,역량,1,"수돗물, 음용, 행사, 인식, 기업, 생수, 변화, 서포터즈, 활동, 제품, 블라인드, 테스트, 이유, 소독, 불신, 관리, 상수, 내실, 년도, 시작"
회계담당자,신입,1,경험,14,"친구, 경험, 계획, 결과, 생각, 활동, 의견, 이야기, 도전, 갈등, 학생, 고객, 시간, 우리, 해결, 노력, 분석, 모두, 목표, 이해"
회계담당자,신입,2,성장과정,4,"경험, 부모, 우산, 동아리, 사람, 노력, 모습, 배려, 친구, 사원, 가르침, 말씀, 생각, 능동, 끈기, 자세, 시절, 대학, 전달, 추구"
회계담당자,신입,3,지원동기,3,"업무, 지원, 블로그, 경영, 생각, 어민, 회사, 마음, 처리, 포스코, 대우, 자금, 관리, 검토, 계약, 감사, 인정, 실수, 창출, 수협"
회계담당자,신입,4,직무,3,"회계, 시간, 경험, 정리, 생각, 시스템, 직무, 관리, 지식, 서고, 도서관, 책장, 분야, 복합, 정확, 사고, 분석, 산업, 시험, 도서"
회계담당자,신입,5,장단점,3,"진행, 생각, 시작, 프로젝트, 상황, 서로, 주장, 자신, 능력, 홍보, 사람, 인생관, 상대, 타인, 소통, 의사소통, 중학교, 활동, 긍정, 분위기"
회계담당자,인턴,1,직무,2,"회계, 지원, 관련, 업무, 기업, 한국자산관리공사, 금융, 분석, 활용, 정보, 재무, 자료, 전공, 공부, 사업, 경제, 개인, 신용, 생각, 능력"
회계담당자,인턴,2,경험,2,"봉사, 활동, 부원, 회계, 도착, 능력, 업무, 파악, 목표, 동아리, 역할, 삼립, 자부심, 전문가, 성장, 정확, 필요, 비용, 최소, 지식"
회계담당자,인턴,3,강점,1,"지원, 회계, 한국자산관리공사, 수업, 처음, 경제, 지식, 활용, 개인, 신용, 회복, 전문, 인재, 생각, 방과, 자격증, 취득, 처리, 프로그램, 운용"
